
    =========================== USB Port5 ===========================

Connection Status        : 0x01 (Device is connected)
Port Chain               : 2-5
Properties               : 0x0D
 IsUserConnectable       : yes
 PortIsDebugCapable      : no
 PortHasMultiCompanions  : yes
 PortConnectorIsTypeC    : yes
ConnectionIndex          : 0x05 (Port 5)
CompanionIndex           : 0
 CompanionHubSymLnk      : USB#ROOT_HUB30#4&32051b5f&2&0#{f18a0e88-c30c-11d0-8815-00a0c906bed8}
 CompanionPortNumber     : 0x12 (Port 18)
 -> CompanionPortChain   : 2-18

      ========================== Summary =========================
Vendor ID                : 0x2DC8 (Shenzhen 8Bitdo Tech Co., Ltd.)
Product ID               : 0x6012
Manufacturer String      : "8BitDo"
Product String           : "8BitDo Ultimate 2 Wireless Controller for PC"
Serial                   : "592A52264F"
USB Version              : 2.0 (but 12 Mbit/s FullSpeed only)
Port maximum Speed       : High-Speed (Companion Port 2-18 is doing the SuperSpeed)
Device maximum Speed     : Full-Speed
Device Connection Speed  : Full-Speed
Self powered             : no
Demanded Current         : 480 mA
Used Endpoints           : 3

      ======================== USB Device ========================

        +++++++++++++++++ Device Information ++++++++++++++++++
Device Description       : USB Input Device
BusReported Device Desc  : 8BitDo Ultimate 2 Wireless Controller for PC
Device Path 1            : \\?\USB#VID_2DC8&PID_6012#592A52264F#{a5dcbf10-6530-11d2-901f-00c04fb951ed} (GUID_DEVINTERFACE_USB_DEVICE)
Device Path 2            : \\?\USB#VID_2DC8&PID_6012#592A52264F#{0c320ff7-bd9b-42b6-bdaf-49feb9c91649}
Kernel Name              : \Device\USBPDO-17
Device ID                : USB\VID_2DC8&PID_6012\592A52264F
Hardware IDs             : USB\VID_2DC8&PID_6012&REV_0001 USB\VID_2DC8&PID_6012
Driver KeyName           : {745a17a0-74d3-11d0-b6fe-00a0c90f57da}\0018 (GUID_DEVCLASS_HIDCLASS)
Driver                   : \SystemRoot\System32\drivers\hidusb.sys (Version: 10.0.26100.8115  Date: 2026-04-14  Company: Microsoft Corporation)
Driver Inf               : C:\WINDOWS\inf\input.inf
Legacy BusType           : PNPBus
Class                    : HIDClass
Class GUID               : {745a17a0-74d3-11d0-b6fe-00a0c90f57da} (GUID_DEVCLASS_HIDCLASS)
Service                  : HidUsb
Enumerator               : USB
Location Info            : Port_#0005.Hub_#0001
Address                  : 5
Location IDs             : PCIROOT(0)#PCI(1400)#USBROOT(0)#USB(5), ACPI(_SB_)#ACPI(PC00)#ACPI(XHCI)#ACPI(RHUB)#ACPI(HS05)
Container ID             : {f550bfa1-28e8-5563-8014-6b06522f6b0c}
Manufacturer Info        : (Standard system devices)
Capabilities             : 0x94 (Removable, UniqueID, SurpriseRemovalOK)
Status                   : 0x0180600A (DN_DRIVER_LOADED, DN_STARTED, DN_DISABLEABLE, DN_REMOVABLE, DN_NT_ENUMERATOR, DN_NT_DRIVER)
First Install Date       : 2026-04-07 15:23:58
Last Arrival Date        : 2026-04-18 14:20:55
SelectiveSuspendEnabled  : 0
EnhancedPowerMgmtEnabled : 1
Power State              : D0 (supported: D0, D3, wake from D0)

        +++++++++++++++++ Registry USB Flags +++++++++++++++++
HKEY_LOCAL_MACHINE\SYSTEM\CurrentControlSet\Control\usbflags\2DC860120001
 osvc                    : REG_BINARY 00 00

        ---------------- Connection Information ---------------
Connection Index         : 0x05 (Port 5)
Connection Status        : 0x01 (DeviceConnected)
Current Config Value     : 0x01 (Configuration 1)
Device Address           : 0x20 (32)
Is Hub                   : 0x00 (no)
Device Bus Speed         : 0x01 (Full-Speed)
Number of open Pipes     : 0x02 (2 pipes to data endpoints)
Pipe[0]                  : EndpointID=4  Direction=IN   ScheduleOffset=0  Type=Interrupt  wMaxPacketSize=0x40    bInterval=1   -> 718 Bits/ms = 89750 Bytes/s
Pipe[1]                  : EndpointID=5  Direction=OUT  ScheduleOffset=0  Type=Interrupt  wMaxPacketSize=0x40    bInterval=1   -> 718 Bits/ms = 89750 Bytes/s

        --------------- Connection Information V2 -------------
Connection Index         : 0x05 (5)
Length                   : 0x10 (16 bytes)
SupportedUsbProtocols    : 0x03
 Usb110                  : 1 (yes, port supports USB 1.1)
 Usb200                  : 1 (yes, port supports USB 2.0)
 Usb300                  : 0 (no, port not supports USB 3.0) -> but Companion Port 2-18 does
 ReservedMBZ             : 0x00
Flags                    : 0x00
 DevIsOpAtSsOrHigher     : 0 (Device is not operating at SuperSpeed or higher)
 DevIsSsCapOrHigher      : 0 (Device is not SuperSpeed capable or higher)
 DevIsOpAtSsPlusOrHigher : 0 (Device is not operating at SuperSpeedPlus or higher)
 DevIsSsPlusCapOrHigher  : 0 (Device is not SuperSpeedPlus capable or higher)
 ReservedMBZ             : 0x00

    ---------------------- Device Descriptor ----------------------
bLength                  : 0x12 (18 bytes)
bDescriptorType          : 0x01 (Device Descriptor)
bcdUSB                   : 0x200 (USB Version 2.0) -> but device is Full-Speed only
bDeviceClass             : 0x00 (defined by the interface descriptors)
bDeviceSubClass          : 0x00
bDeviceProtocol          : 0x00
bMaxPacketSize0          : 0x08 (8 bytes)
idVendor                 : 0x2DC8 (Shenzhen 8Bitdo Tech Co., Ltd.)
idProduct                : 0x6012
bcdDevice                : 0x0001
iManufacturer            : 0x01 (String Descriptor 1)
 Language 0x0409         : "8BitDo"
iProduct                 : 0x02 (String Descriptor 2)
 Language 0x0409         : "8BitDo Ultimate 2 Wireless Controller for PC"
iSerialNumber            : 0x03 (String Descriptor 3)
 Language 0x0409         : "592A52264F"
bNumConfigurations       : 0x01 (1 Configuration)

    ------------------ Configuration Descriptor -------------------
bLength                  : 0x09 (9 bytes)
bDescriptorType          : 0x02 (Configuration Descriptor)
wTotalLength             : 0x0029 (41 bytes)
bNumInterfaces           : 0x01 (1 Interface)
bConfigurationValue      : 0x01 (Configuration 1)
iConfiguration           : 0x00 (No String Descriptor)
bmAttributes             : 0x80
 D7: Reserved, set 1     : 0x01
 D6: Self Powered        : 0x00 (no)
 D5: Remote Wakeup       : 0x00 (no)
 D4..0: Reserved, set 0  : 0x00
MaxPower                 : 0xF0 (480 mA)

        ---------------- Interface Descriptor -----------------
bLength                  : 0x09 (9 bytes)
bDescriptorType          : 0x04 (Interface Descriptor)
bInterfaceNumber         : 0x00 (Interface 0)
bAlternateSetting        : 0x00
bNumEndpoints            : 0x02 (2 Endpoints)
bInterfaceClass          : 0x03 (HID - Human Interface Device)
bInterfaceSubClass       : 0x00 (None)
bInterfaceProtocol       : 0x00 (None)
iInterface               : 0x00 (No String Descriptor)

        ------------------- HID Descriptor --------------------
bLength                  : 0x09 (9 bytes)
bDescriptorType          : 0x21 (HID Descriptor)
bcdHID                   : 0x0111 (HID Version 1.11)
bCountryCode             : 0x00 (00 = not localized)
bNumDescriptors          : 0x01
Descriptor 1:
bDescriptorType          : 0x22 (Class=Report)
wDescriptorLength        : 0x0071 (113 bytes)
Error reading descriptor : ERROR_GEN_FAILURE (due to a obscure limitation of the Win32 USB API, see F1 Help)

        ----------------- Endpoint Descriptor -----------------
bLength                  : 0x07 (7 bytes)
bDescriptorType          : 0x05 (Endpoint Descriptor)
bEndpointAddress         : 0x84 (Direction=IN EndpointID=4)
bmAttributes             : 0x03 (TransferType=Interrupt)
wMaxPacketSize           : 0x0040 (64 bytes)
bInterval                : 0x01 (1 ms)

        ----------------- Endpoint Descriptor -----------------
bLength                  : 0x07 (7 bytes)
bDescriptorType          : 0x05 (Endpoint Descriptor)
bEndpointAddress         : 0x05 (Direction=OUT EndpointID=5)
bmAttributes             : 0x03 (TransferType=Interrupt)
wMaxPacketSize           : 0x0040 (64 bytes)
bInterval                : 0x01 (1 ms)

    ----------------- Device Qualifier Descriptor -----------------
Error                    : request skipped because low-speed device

      -------------------- String Descriptors -------------------
             ------ String Descriptor 0 ------
bLength                  : 0x04 (4 bytes)
bDescriptorType          : 0x03 (String Descriptor)
Language ID[0]           : 0x0409 (English - United States)
             ------ String Descriptor 1 ------
bLength                  : 0x0E (14 bytes)
bDescriptorType          : 0x03 (String Descriptor)
Language 0x0409          : "8BitDo"
             ------ String Descriptor 2 ------
bLength                  : 0x5A (90 bytes)
bDescriptorType          : 0x03 (String Descriptor)
Language 0x0409          : "8BitDo Ultimate 2 Wireless Controller for PC"
             ------ String Descriptor 3 ------
bLength                  : 0x16 (22 bytes)
bDescriptorType          : 0x03 (String Descriptor)
Language 0x0409          : "592A52264F"

        +++++++++++++++++ Device Information ++++++++++++++++++
Device Description       : HID-compliant game controller
Device Path 1            : \\?\HID#VID_2DC8&PID_6012#6&285e55b3&1&0000#{4d1e55b2-f16f-11cf-88cb-001111000030} (GUID_DEVINTERFACE_HID)
Device Path 2            : \\?\HID#VID_2DC8&PID_6012#6&285e55b3&1&0000#{0c320ff7-bd9b-42b6-bdaf-49feb9c91649}
Kernel Name              : \Device\00000172
Device ID                : HID\VID_2DC8&PID_6012\6&285E55B3&1&0000
Hardware IDs             : HID\VID_2DC8&PID_6012&REV_0001 HID\VID_2DC8&PID_6012 HID\VID_2DC8&UP:0001_U:0005 HID_DEVICE_SYSTEM_GAME HID_DEVICE_UP:0001_U:0005 HID_DEVICE
Driver KeyName           : {745a17a0-74d3-11d0-b6fe-00a0c90f57da}\0019 (GUID_DEVCLASS_HIDCLASS)
Driver Inf               : C:\WINDOWS\inf\input.inf
Legacy BusType           : PNPBus
Class                    : HIDClass
Class GUID               : {745a17a0-74d3-11d0-b6fe-00a0c90f57da} (GUID_DEVCLASS_HIDCLASS)
Service                  : -
Enumerator               : HID
Location Info            : -
Address                  : 1
Manufacturer Info        : (Standard system devices)
Capabilities             : 0xE0 (SilentInstall, RawDeviceOK, SurpriseRemovalOK)
Status                   : 0x0180200A (DN_DRIVER_LOADED, DN_STARTED, DN_DISABLEABLE, DN_NT_ENUMERATOR, DN_NT_DRIVER)
First Install Date       : 2026-04-11 14:29:05
Last Arrival Date        : 2026-04-18 14:20:55
EnhancedPowerMgmtEnabled : 0
Power State              : D0 (supported: D0, D3, wake from D0)

             ++++++++++++++ HID Information +++++++++++++++
Manufacturer             : 8BitDo
Product                  : 8BitDo Ultimate 2 Wireless Controller for PC
Serial Number            : 592A52264F
UsagePage                : 0x01 (Generic Desktop Controls)
Usage                    : 0x05 (Gamepad)
